root@comp3134-winter2023:~# tcpdump -i eth0
tcpdump: verbose output suppressed, use -v or -vv for full protocol decode
listening on eth0, link-type EN10MB (Ethernet), capture size 262144 bytes
20:19:52.324948 IP comp3134-winter2023.ssh > 198.96.84.224.50620: Flags [P.], seq 109832352:109832460, ack 3544053725, win 501, length 108
20:19:52.325089 IP comp3134-winter2023.ssh > 198.96.84.224.50620: Flags [P.], seq 108:144, ack 1, win 501, length 36
20:19:52.325170 IP comp3134-winter2023.ssh > 198.96.84.224.50620: Flags [P.], seq 144:252, ack 1, win 501, length 108
20:19:52.325240 IP comp3134-winter2023.ssh > 198.96.84.224.50620: Flags [P.], seq 252:288, ack 1, win 501, length 36
20:19:52.326023 IP comp3134-winter2023.53631 > 67.207.67.2.domain: 28128+ [1au] PTR? 224.84.96.198.in-addr.arpa. (55)
20:19:52.326384 IP comp3134-winter2023.44764 > 67.207.67.2.domain: 33659+ [1au] PTR? 224.84.96.198.in-addr.arpa. (55)
20:19:52.326644 IP comp3134-winter2023.45775 > 67.207.67.2.domain: 10996+ [1au] PTR? 224.84.96.198.in-addr.arpa. (55)
20:19:52.329461 IP 198.96.84.224.50620 > comp3134-winter2023.ssh: Flags [.], ack 288, win 512, length 0
20:19:52.329462 IP 67.207.67.2.domain > comp3134-winter2023.45775: 10996 NXDomain 0/1/1 (120)
20:19:52.329462 IP 67.207.67.2.domain > comp3134-winter2023.44764: 33659 NXDomain 0/1/1 (120)
20:19:52.329462 IP 67.207.67.2.domain > comp3134-winter2023.53631: 28128 NXDomain 0/1/1 (120)
20:19:52.329657 IP comp3134-winter2023.45775 > 67.207.67.2.domain: 10996+ PTR? 224.84.96.198.in-addr.arpa. (44)
20:19:52.329901 IP comp3134-winter2023.53631 > 67.207.67.2.domain: 28128+ PTR? 224.84.96.198.in-addr.arpa. (44)
20:19:52.330048 IP 67.207.67.2.domain > comp3134-winter2023.45775: 10996 NXDomain 0/1/0 (109)
20:19:52.330067 IP comp3134-winter2023.44764 > 67.207.67.2.domain: 33659+ PTR? 224.84.96.198.in-addr.arpa. (44)
20:19:52.330218 IP 67.207.67.2.domain > comp3134-winter2023.53631: 28128 NXDomain 0/1/0 (109)
20:19:52.330419 IP 67.207.67.2.domain > comp3134-winter2023.44764: 33659 NXDomain 0/1/0 (109)
20:19:52.331111 IP comp3134-winter2023.48039 > 67.207.67.2.domain: 64435+ [1au] PTR? 167.224.22.165.in-addr.arpa. (56)
20:19:52.331247 IP comp3134-winter2023.50982 > 67.207.67.2.domain: 45951+ [1au] PTR? 167.224.22.165.in-addr.arpa. (56)
20:19:52.331291 IP comp3134-winter2023.56623 > 67.207.67.2.domain: 32663+ [1au] PTR? 167.224.22.165.in-addr.arpa. (56)
20:19:52.331463 IP 67.207.67.2.domain > comp3134-winter2023.48039: 64435 NXDomain 0/1/1 (123)
20:19:52.331603 IP 67.207.67.2.domain > comp3134-winter2023.50982: 45951 NXDomain 0/1/1 (123)
20:19:52.331603 IP 67.207.67.2.domain > comp3134-winter2023.56623: 32663 NXDomain 0/1/1 (123)
20:19:52.331682 IP comp3134-winter2023.48039 > 67.207.67.2.domain: 64435+ PTR? 167.224.22.165.in-addr.arpa. (45)
20:19:52.331758 IP comp3134-winter2023.50982 > 67.207.67.2.domain: 45951+ PTR? 167.224.22.165.in-addr.arpa. (45)
20:19:52.331812 IP comp3134-winter2023.56623 > 67.207.67.2.domain: 32663+ PTR? 167.224.22.165.in-addr.arpa. (45)
20:19:52.331962 IP 67.207.67.2.domain > comp3134-winter2023.48039: 64435 NXDomain 0/1/0 (112)
20:19:52.332122 IP 67.207.67.2.domain > comp3134-winter2023.50982: 45951 NXDomain 0/1/0 (112)
20:19:52.332122 IP 67.207.67.2.domain > comp3134-winter2023.56623: 32663 NXDomain 0/1/0 (112)
20:19:52.332657 IP comp3134-winter2023.ssh > 198.96.84.224.50620: Flags [P.], seq 288:460, ack 1, win 501, length 172
20:19:52.332753 IP comp3134-winter2023.ssh > 198.96.84.224.50620: Flags [P.], seq 460:652, ack 1, win 501, length 192
20:19:52.333245 IP comp3134-winter2023.45606 > 67.207.67.2.domain: 21536+ [1au] PTR? 2.67.207.67.in-addr.arpa. (53)
20:19:52.333304 IP comp3134-winter2023.37186 > 67.207.67.2.domain: 10930+ [1au] PTR? 2.67.207.67.in-addr.arpa. (53)
20:19:52.333358 IP comp3134-winter2023.34566 > 67.207.67.2.domain: 50998+ [1au] PTR? 2.67.207.67.in-addr.arpa. (53)
20:19:52.333601 IP comp3134-winter2023.ssh > 198.96.84.224.50620: Flags [P.], seq 652:1072, ack 1, win 501, length 420
20:19:52.333774 IP 67.207.67.2.domain > comp3134-winter2023.45606: 21536 NXDomain 0/1/1 (120)
20:19:52.335355 IP comp3134-winter2023.ssh > 198.96.84.224.50620: Flags [P.], seq 1264:1420, ack 1, win 501, length 156
20:19:52.335466 IP comp3134-winter2023.ssh > 198.96.84.224.50620: Flags [P.], seq 1456:1612, ack 1, win 501, length 156
20:19:52.335546 IP comp3134-winter2023.ssh > 198.96.84.224.50620: Flags [P.], seq 1648:1788, ack 1, win 501, length 140
20:19:52.339000 IP 198.96.84.224.50620 > comp3134-winter2023.ssh: Flags [.], ack 1228, win 509, length 0
20:19:52.339001 IP 198.96.84.224.50620 > comp3134-winter2023.ssh: Flags [.], ack 1612, win 512, length 0
20:19:52.339001 IP 198.96.84.224.50620 > comp3134-winter2023.ssh: Flags [.], ack 1788, win 512, length 0
20:19:52.339891 IP comp3134-winter2023.ssh > 198.96.84.224.50620: Flags [P.], seq 2160:2292, ack 1, win 501, length 132
20:19:52.339959 IP comp3134-winter2023.ssh > 198.96.84.224.50620: Flags [P.], seq 2292:4816, ack 1, win 501, length 2524
20:19:52.340200 IP comp3134-winter2023.ssh > 198.96.84.224.50620: Flags [P.], seq 4816:5996, ack 1, win 501, length 1180
20:19:52.340271 IP comp3134-winter2023.ssh > 198.96.84.224.50620: Flags [P.], seq 5996:6152, ack 1, win 501, length 156
20:19:52.340327 IP comp3134-winter2023.ssh > 198.96.84.224.50620: Flags [P.], seq 6152:6308, ack 1, win 501, length 156
20:19:52.343247 IP 198.96.84.224.50620 > comp3134-winter2023.ssh: Flags [.], ack 2160, win 510, length 0
20:19:52.343247 IP 198.96.84.224.50620 > comp3134-winter2023.ssh: Flags [.], ack 4816, win 512, length 0
20:19:52.343247 IP 198.96.84.224.50620 > comp3134-winter2023.ssh: Flags [.], ack 6308, win 512, length 0
20:19:52.343447 IP comp3134-winter2023.ssh > 198.96.84.224.50620: Flags [P.], seq 6308:6464, ack 1, win 501, length 156
20:19:52.343531 IP comp3134-winter2023.ssh > 198.96.84.224.50620: Flags [P.], seq 6464:6820, ack 1, win 501, length 356
20:19:52.343596 IP comp3134-winter2023.ssh > 198.96.84.224.50620: Flags [P.], seq 6820:6976, ack 1, win 501, length 156
20:19:52.343648 IP comp3134-winter2023.ssh > 198.96.84.224.50620: Flags [P.], seq 6976:7132, ack 1, win 501, length 156
20:19:52.343702 IP comp3134-winter2023.ssh > 198.96.84.224.50620: Flags [P.], seq 7132:7288, ack 1, win 501, length 156
20:19:52.343753 IP comp3134-winter2023.ssh > 198.96.84.224.50620: Flags [P.], seq 7288:7444, ack 1, win 501, length 156
20:19:52.343910 IP comp3134-winter2023.ssh > 198.96.84.224.50620: Flags [P.], seq 7444:7600, ack 1, win 501, length 156
20:19:52.344045 IP comp3134-winter2023.ssh > 198.96.84.224.50620: Flags [P.], seq 7600:7756, ack 1, win 501, length 156
20:19:52.344155 IP comp3134-winter2023.ssh > 198.96.84.224.50620: Flags [P.], seq 7756:7912, ack 1, win 501, length 156
20:19:52.344235 IP comp3134-winter2023.ssh > 198.96.84.224.50620: Flags [P.], seq 7912:8068, ack 1, win 501, length 156
20:19:52.344313 IP comp3134-winter2023.ssh > 198.96.84.224.50620: Flags [P.], seq 8068:8224, ack 1, win 501, length 156
20:19:52.344368 IP comp3134-winter2023.ssh > 198.96.84.224.50620: Flags [P.], seq 8224:8536, ack 1, win 501, length 312
20:19:52.344423 IP comp3134-winter2023.ssh > 198.96.84.224.50620: Flags [P.], seq 8536:8692, ack 1, win 501, length 156
20:19:52.344475 IP comp3134-winter2023.ssh > 198.96.84.224.50620: Flags [P.], seq 8692:8848, ack 1, win 501, length 156
20:19:52.344572 IP comp3134-winter2023.ssh > 198.96.84.224.50620: Flags [P.], seq 8848:9004, ack 1, win 501, length 156
20:19:52.344807 IP comp3134-winter2023.ssh > 198.96.84.224.50620: Flags [P.], seq 9004:9160, ack 1, win 501, length 156
20:19:52.344929 IP comp3134-winter2023.ssh > 198.96.84.224.50620: Flags [P.], seq 9160:9316, ack 1, win 501, length 156
20:19:52.345191 IP comp3134-winter2023.ssh > 198.96.84.224.50620: Flags [P.], seq 9316:9472, ack 1, win 501, length 156
20:19:52.345434 IP comp3134-winter2023.ssh > 198.96.84.224.50620: Flags [P.], seq 9472:9628, ack 1, win 501, length 156
20:19:52.345526 IP comp3134-winter2023.ssh > 198.96.84.224.50620: Flags [P.], seq 9628:9784, ack 1, win 501, length 156
20:19:52.346280 IP 198.96.84.224.50620 > comp3134-winter2023.ssh: Flags [.], ack 7444, win 508, length 0
20:19:52.346280 IP 198.96.84.224.50620 > comp3134-winter2023.ssh: Flags [.], ack 8068, win 512, length 0
20:19:52.346345 IP comp3134-winter2023.ssh > 198.96.84.224.50620: Flags [P.], seq 9784:9940, ack 1, win 501, length 156
20:19:52.346494 IP comp3134-winter2023.ssh > 198.96.84.224.50620: Flags [P.], seq 9940:10312, ack 1, win 501, length 372
20:19:52.346599 IP 198.96.84.224.50620 > comp3134-winter2023.ssh: Flags [.], ack 8848, win 509, length 0
20:19:52.346613 IP comp3134-winter2023.ssh > 198.96.84.224.50620: Flags [P.], seq 10312:10468, ack 1, win 501, length 156
20:19:52.346702 IP comp3134-winter2023.ssh > 198.96.84.224.50620: Flags [P.], seq 10468:10736, ack 1, win 501, length 268
20:19:52.346982 IP comp3134-winter2023.ssh > 198.96.84.224.50620: Flags [P.], seq 10736:10900, ack 1, win 501, length 164
20:19:52.347037 IP comp3134-winter2023.ssh > 198.96.84.224.50620: Flags [P.], seq 10900:11064, ack 1, win 501, length 164
20:19:52.347156 IP comp3134-winter2023.ssh > 198.96.84.224.50620: Flags [P.], seq 11064:11228, ack 1, win 501, length 164
20:19:52.347232 IP comp3134-winter2023.ssh > 198.96.84.224.50620: Flags [P.], seq 11228:11392, ack 1, win 501, length 164
20:19:52.347361 IP comp3134-winter2023.ssh > 198.96.84.224.50620: Flags [P.], seq 11392:11556, ack 1, win 501, length 164
20:19:52.347491 IP comp3134-winter2023.ssh > 198.96.84.224.50620: Flags [P.], seq 11556:11720, ack 1, win 501, length 164
20:19:52.347553 IP comp3134-winter2023.ssh > 198.96.84.224.50620: Flags [P.], seq 11720:11884, ack 1, win 501, length 164
20:19:52.347608 IP comp3134-winter2023.ssh > 198.96.84.224.50620: Flags [P.], seq 11884:12048, ack 1, win 501, length 164
20:19:52.347656 IP comp3134-winter2023.ssh > 198.96.84.224.50620: Flags [P.], seq 12048:12212, ack 1, win 501, length 164
20:19:52.347708 IP comp3134-winter2023.ssh > 198.96.84.224.50620: Flags [P.], seq 12212:12376, ack 1, win 501, length 164
20:19:52.347859 IP 198.96.84.224.50620 > comp3134-winter2023.ssh: Flags [.], ack 9316, win 508, length 0
20:19:52.347887 IP comp3134-winter2023.ssh > 198.96.84.224.50620: Flags [P.], seq 12376:12540, ack 1, win 501, length 164
20:19:52.347982 IP comp3134-winter2023.ssh > 198.96.84.224.50620: Flags [P.], seq 12540:12808, ack 1, win 501, length 268
20:19:52.348060 IP comp3134-winter2023.ssh > 198.96.84.224.50620: Flags [P.], seq 12808:12972, ack 1, win 501, length 164
20:19:52.348192 IP comp3134-winter2023.ssh > 198.96.84.224.50620: Flags [P.], seq 12972:13136, ack 1, win 501, length 164
20:19:52.348254 IP comp3134-winter2023.ssh > 198.96.84.224.50620: Flags [P.], seq 13136:13300, ack 1, win 501, length 164
20:19:52.348311 IP comp3134-winter2023.ssh > 198.96.84.224.50620: Flags [P.], seq 13300:13464, ack 1, win 501, length 164
20:19:52.348525 IP comp3134-winter2023.ssh > 198.96.84.224.50620: Flags [P.], seq 13464:13628, ack 1, win 501, length 164
20:19:52.348575 IP 198.96.84.224.50620 > comp3134-winter2023.ssh: Flags [.], ack 9784, win 512, length 0
20:19:52.348637 IP comp3134-winter2023.ssh > 198.96.84.224.50620: Flags [P.], seq 13628:13896, ack 1, win 501, length 268
20:19:52.348694 IP comp3134-winter2023.ssh > 198.96.84.224.50620: Flags [P.], seq 13896:14060, ack 1, win 501, length 164
20:19:52.348815 IP comp3134-winter2023.ssh > 198.96.84.224.50620: Flags [P.], seq 14060:14224, ack 1, win 501, length 164
20:19:52.348937 IP comp3134-winter2023.ssh > 198.96.84.224.50620: Flags [P.], seq 14224:14388, ack 1, win 501, length 164
20:19:52.349051 IP comp3134-winter2023.ssh > 198.96.84.224.50620: Flags [P.], seq 14388:14552, ack 1, win 501, length 164
20:19:52.349105 IP comp3134-winter2023.ssh > 198.96.84.224.50620: Flags [P.], seq 14552:14716, ack 1, win 501, length 164
20:19:52.349204 IP comp3134-winter2023.ssh > 198.96.84.224.50620: Flags [P.], seq 14716:14880, ack 1, win 501, length 164
20:19:52.349320 IP comp3134-winter2023.ssh > 198.96.84.224.50620: Flags [P.], seq 14880:15044, ack 1, win 501, length 164
20:19:52.349337 IP 198.96.84.224.50620 > comp3134-winter2023.ssh: Flags [.], ack 10468, win 510, length 0
20:19:52.349418 IP comp3134-winter2023.ssh > 198.96.84.224.50620: Flags [P.], seq 15044:15312, ack 1, win 501, length 268
20:19:52.349493 IP comp3134-winter2023.ssh > 198.96.84.224.50620: Flags [P.], seq 15312:15476, ack 1, win 501, length 164
20:19:52.349650 IP comp3134-winter2023.ssh > 198.96.84.224.50620: Flags [P.], seq 15476:15640, ack 1, win 501, length 164
20:19:52.349716 IP comp3134-winter2023.ssh > 198.96.84.224.50620: Flags [P.], seq 15640:15804, ack 1, win 501, length 164
20:19:52.350060 IP comp3134-winter2023.ssh > 198.96.84.224.50620: Flags [P.], seq 15804:15968, ack 1, win 501, length 164
20:19:52.350231 IP comp3134-winter2023.ssh > 198.96.84.224.50620: Flags [P.], seq 15968:16132, ack 1, win 501, length 164
20:19:52.350321 IP 198.96.84.224.50620 > comp3134-winter2023.ssh: Flags [.], ack 11228, win 512, length 0
20:19:52.350340 IP comp3134-winter2023.ssh > 198.96.84.224.50620: Flags [P.], seq 16132:16296, ack 1, win 501, length 164
20:19:52.350514 IP comp3134-winter2023.ssh > 198.96.84.224.50620: Flags [P.], seq 16296:16564, ack 1, win 501, length 268
20:19:52.350578 IP comp3134-winter2023.ssh > 198.96.84.224.50620: Flags [P.], seq 16564:16728, ack 1, win 501, length 164
20:19:52.350635 IP comp3134-winter2023.ssh > 198.96.84.224.50620: Flags [P.], seq 16728:16892, ack 1, win 501, length 164
20:19:52.351650 IP 198.96.84.224.50620 > comp3134-winter2023.ssh: Flags [.], ack 13136, win 512, length 0
20:19:52.351650 IP 198.96.84.224.50620 > comp3134-winter2023.ssh: Flags [.], ack 14552, win 512, length 0
20:19:52.351689 IP comp3134-winter2023.ssh > 198.96.84.224.50620: Flags [P.], seq 16892:17056, ack 1, win 501, length 164
20:19:52.351819 IP comp3134-winter2023.ssh > 198.96.84.224.50620: Flags [P.], seq 17056:17428, ack 1, win 501, length 372
20:19:52.351876 IP comp3134-winter2023.ssh > 198.96.84.224.50620: Flags [P.], seq 17428:17592, ack 1, win 501, length 164
20:19:52.351995 IP comp3134-winter2023.ssh > 198.96.84.224.50620: Flags [P.], seq 17592:17756, ack 1, win 501, length 164
20:19:52.352501 IP comp3134-winter2023.ssh > 198.96.84.224.50620: Flags [P.], seq 17756:17920, ack 1, win 501, length 164
20:19:52.352575 IP comp3134-winter2023.ssh > 198.96.84.224.50620: Flags [P.], seq 17920:18084, ack 1, win 501, length 164
20:19:52.352684 IP comp3134-winter2023.ssh > 198.96.84.224.50620: Flags [P.], seq 18084:18248, ack 1, win 501, length 164
20:19:52.352775 IP comp3134-winter2023.ssh > 198.96.84.224.50620: Flags [P.], seq 18248:18412, ack 1, win 501, length 164
20:19:52.352789 IP 198.96.84.224.50620 > comp3134-winter2023.ssh: Flags [.], ack 15804, win 508, length 0
20:19:52.352846 IP 198.96.84.224.50620 > comp3134-winter2023.ssh: Flags [.], ack 16296, win 512, length 0
20:19:52.352877 IP comp3134-winter2023.ssh > 198.96.84.224.50620: Flags [P.], seq 18412:18680, ack 1, win 501, length 268
20:19:52.352947 IP comp3134-winter2023.ssh > 198.96.84.224.50620: Flags [P.], seq 18680:18948, ack 1, win 501, length 268
20:19:52.353002 IP comp3134-winter2023.ssh > 198.96.84.224.50620: Flags [P.], seq 18948:19112, ack 1, win 501, length 164
20:19:52.353056 IP comp3134-winter2023.ssh > 198.96.84.224.50620: Flags [P.], seq 19112:19276, ack 1, win 501, length 164
20:19:52.353109 IP comp3134-winter2023.ssh > 198.96.84.224.50620: Flags [P.], seq 19276:19440, ack 1, win 501, length 164
20:19:52.353162 IP comp3134-winter2023.ssh > 198.96.84.224.50620: Flags [P.], seq 19440:19604, ack 1, win 501, length 164
20:19:52.353215 IP comp3134-winter2023.ssh > 198.96.84.224.50620: Flags [P.], seq 19604:19768, ack 1, win 501, length 164
20:19:52.353266 IP comp3134-winter2023.ssh > 198.96.84.224.50620: Flags [P.], seq 19768:19932, ack 1, win 501, length 164
20:19:52.353336 IP comp3134-winter2023.ssh > 198.96.84.224.50620: Flags [P.], seq 19932:20096, ack 1, win 501, length 164
20:19:52.353389 IP comp3134-winter2023.ssh > 198.96.84.224.50620: Flags [P.], seq 20096:20260, ack 1, win 501, length 164
20:19:52.353442 IP comp3134-winter2023.ssh > 198.96.84.224.50620: Flags [P.], seq 20260:20424, ack 1, win 501, length 164
20:19:52.353495 IP comp3134-winter2023.ssh > 198.96.84.224.50620: Flags [P.], seq 20424:20588, ack 1, win 501, length 164
20:19:52.353548 IP comp3134-winter2023.ssh > 198.96.84.224.50620: Flags [P.], seq 20588:20752, ack 1, win 501, length 164
20:19:52.353601 IP comp3134-winter2023.ssh > 198.96.84.224.50620: Flags [P.], seq 20752:20916, ack 1, win 501, length 164
20:19:52.353667 IP comp3134-winter2023.ssh > 198.96.84.224.50620: Flags [P.], seq 20916:21080, ack 1, win 501, length 164
20:19:52.353724 IP comp3134-winter2023.ssh > 198.96.84.224.50620: Flags [P.], seq 21080:21244, ack 1, win 501, length 164
20:19:52.353832 IP comp3134-winter2023.ssh > 198.96.84.224.50620: Flags [P.], seq 21244:21408, ack 1, win 501, length 164
20:19:52.353922 IP comp3134-winter2023.ssh > 198.96.84.224.50620: Flags [P.], seq 21408:21572, ack 1, win 501, length 164
20:19:52.353976 IP comp3134-winter2023.ssh > 198.96.84.224.50620: Flags [P.], seq 21572:21736, ack 1, win 501, length 164
20:19:52.354028 IP comp3134-winter2023.ssh > 198.96.84.224.50620: Flags [P.], seq 21736:21900, ack 1, win 501, length 164
20:19:52.354279 IP comp3134-winter2023.ssh > 198.96.84.224.50620: Flags [P.], seq 21900:22064, ack 1, win 501, length 164
20:19:52.354356 IP comp3134-winter2023.ssh > 198.96.84.224.50620: Flags [P.], seq 22064:22228, ack 1, win 501, length 164
20:19:52.354607 IP 198.96.84.224.50620 > comp3134-winter2023.ssh: Flags [.], ack 16892, win 510, length 0
20:19:52.354607 IP 198.96.84.224.50620 > comp3134-winter2023.ssh: Flags [.], ack 17756, win 512, length 0
20:19:52.354607 IP 198.96.84.224.50620 > comp3134-winter2023.ssh: Flags [.], ack 18248, win 510, length 0
20:19:52.354631 IP comp3134-winter2023.ssh > 198.96.84.224.50620: Flags [P.], seq 22228:22392, ack 1, win 501, length 164
20:19:52.354968 IP comp3134-winter2023.ssh > 198.96.84.224.50620: Flags [P.], seq 22392:22876, ack 1, win 501, length 484
20:19:52.355173 IP comp3134-winter2023.ssh > 198.96.84.224.50620: Flags [P.], seq 22876:23040, ack 1, win 501, length 164
20:19:52.355241 IP comp3134-winter2023.ssh > 198.96.84.224.50620: Flags [P.], seq 23040:23204, ack 1, win 501, length 164
20:19:52.355310 IP comp3134-winter2023.ssh > 198.96.84.224.50620: Flags [P.], seq 23204:23368, ack 1, win 501, length 164
20:19:52.355356 IP comp3134-winter2023.ssh > 198.96.84.224.50620: Flags [P.], seq 23368:23532, ack 1, win 501, length 164
20:19:52.355395 IP comp3134-winter2023.ssh > 198.96.84.224.50620: Flags [P.], seq 23532:23696, ack 1, win 501, length 164
20:19:52.355434 IP comp3134-winter2023.ssh > 198.96.84.224.50620: Flags [P.], seq 23696:23860, ack 1, win 501, length 164
20:19:52.355471 IP comp3134-winter2023.ssh > 198.96.84.224.50620: Flags [P.], seq 23860:24024, ack 1, win 501, length 164
20:19:52.355510 IP comp3134-winter2023.ssh > 198.96.84.224.50620: Flags [P.], seq 24024:24188, ack 1, win 501, length 164
20:19:52.355983 IP 198.96.84.224.50620 > comp3134-winter2023.ssh: Flags [.], ack 19604, win 512, length 0
20:19:52.356009 IP comp3134-winter2023.ssh > 198.96.84.224.50620: Flags [P.], seq 24188:24352, ack 1, win 501, length 164
20:19:52.356222 IP comp3134-winter2023.ssh > 198.96.84.224.50620: Flags [P.], seq 24352:24620, ack 1, win 501, length 268
20:19:52.356278 IP comp3134-winter2023.ssh > 198.96.84.224.50620: Flags [P.], seq 24620:24784, ack 1, win 501, length 164
20:19:52.356327 IP comp3134-winter2023.ssh > 198.96.84.224.50620: Flags [P.], seq 24784:24948, ack 1, win 501, length 164
20:19:52.356372 IP comp3134-winter2023.ssh > 198.96.84.224.50620: Flags [P.], seq 24948:25112, ack 1, win 501, length 164
20:19:52.356582 IP comp3134-winter2023.ssh > 198.96.84.224.50620: Flags [P.], seq 25112:25276, ack 1, win 501, length 164
20:19:52.356645 IP comp3134-winter2023.ssh > 198.96.84.224.50620: Flags [P.], seq 25276:25440, ack 1, win 501, length 164
20:19:52.357888 IP 198.96.84.224.50620 > comp3134-winter2023.ssh: Flags [.], ack 21900, win 512, length 0
20:19:52.357888 IP 198.96.84.224.50620 > comp3134-winter2023.ssh: Flags [.], ack 23532, win 512, length 0
20:19:52.357888 IP 198.96.84.224.50620 > comp3134-winter2023.ssh: Flags [.], ack 24188, win 510, length 0
20:19:52.357936 IP comp3134-winter2023.ssh > 198.96.84.224.50620: Flags [P.], seq 25440:25604, ack 1, win 501, length 164
20:19:52.358122 IP 198.96.84.224.50620 > comp3134-winter2023.ssh: Flags [.], ack 24620, win 508, length 0
20:19:52.358195 IP comp3134-winter2023.ssh > 198.96.84.224.50620: Flags [P.], seq 25604:26192, ack 1, win 501, length 588
20:19:52.358289 IP comp3134-winter2023.ssh > 198.96.84.224.50620: Flags [P.], seq 26192:26356, ack 1, win 501, length 164
20:19:52.358342 IP comp3134-winter2023.ssh > 198.96.84.224.50620: Flags [P.], seq 26356:26520, ack 1, win 501, length 164
20:19:52.358437 IP comp3134-winter2023.ssh > 198.96.84.224.50620: Flags [P.], seq 26520:26684, ack 1, win 501, length 164
20:19:52.358514 IP comp3134-winter2023.ssh > 198.96.84.224.50620: Flags [P.], seq 26684:26848, ack 1, win 501, length 164
20:19:52.359312 IP comp3134-winter2023.ssh > 198.96.84.224.50620: Flags [P.], seq 26848:27012, ack 1, win 501, length 164
20:19:52.359427 IP 198.96.84.224.50620 > comp3134-winter2023.ssh: Flags [.], ack 25440, win 512, length 0
20:19:52.359490 IP comp3134-winter2023.ssh > 198.96.84.224.50620: Flags [P.], seq 27012:27280, ack 1, win 501, length 268
20:19:52.359559 IP comp3134-winter2023.ssh > 198.96.84.224.50620: Flags [P.], seq 27280:27444, ack 1, win 501, length 164
20:19:52.359609 IP comp3134-winter2023.ssh > 198.96.84.224.50620: Flags [P.], seq 27444:27608, ack 1, win 501, length 164
20:19:52.359656 IP comp3134-winter2023.ssh > 198.96.84.224.50620: Flags [P.], seq 27608:27772, ack 1, win 501, length 164
20:19:52.359703 IP comp3134-winter2023.ssh > 198.96.84.224.50620: Flags [P.], seq 27772:27936, ack 1, win 501, length 164
20:19:52.359751 IP comp3134-winter2023.ssh > 198.96.84.224.50620: Flags [P.], seq 27936:28100, ack 1, win 501, length 164
20:19:52.359894 IP comp3134-winter2023.ssh > 198.96.84.224.50620: Flags [P.], seq 28100:28264, ack 1, win 501, length 164
20:19:52.359953 IP comp3134-winter2023.ssh > 198.96.84.224.50620: Flags [P.], seq 28264:28428, ack 1, win 501, length 164
20:19:52.360002 IP comp3134-winter2023.ssh > 198.96.84.224.50620: Flags [P.], seq 28428:28592, ack 1, win 501, length 164
20:19:52.360063 IP comp3134-winter2023.ssh > 198.96.84.224.50620: Flags [P.], seq 28592:28756, ack 1, win 501, length 164
20:19:52.360159 IP comp3134-winter2023.ssh > 198.96.84.224.50620: Flags [P.], seq 28756:28920, ack 1, win 501, length 164
20:19:52.360212 IP comp3134-winter2023.ssh > 198.96.84.224.50620: Flags [P.], seq 28920:29084, ack 1, win 501, length 164
20:19:52.360260 IP comp3134-winter2023.ssh > 198.96.84.224.50620: Flags [P.], seq 29084:29248, ack 1, win 501, length 164
20:19:52.360307 IP comp3134-winter2023.ssh > 198.96.84.224.50620: Flags [P.], seq 29248:29412, ack 1, win 501, length 164
20:19:52.360356 IP comp3134-winter2023.ssh > 198.96.84.224.50620: Flags [P.], seq 29412:29576, ack 1, win 501, length 164
20:19:52.360435 IP comp3134-winter2023.ssh > 198.96.84.224.50620: Flags [P.], seq 29576:29740, ack 1, win 501, length 164
20:19:52.360482 IP comp3134-winter2023.ssh > 198.96.84.224.50620: Flags [P.], seq 29740:29904, ack 1, win 501, length 164
20:19:52.360617 IP comp3134-winter2023.ssh > 198.96.84.224.50620: Flags [P.], seq 29904:30068, ack 1, win 501, length 164
20:19:52.360698 IP comp3134-winter2023.ssh > 198.96.84.224.50620: Flags [P.], seq 30068:30232, ack 1, win 501, length 164
20:19:52.360880 IP comp3134-winter2023.ssh > 198.96.84.224.50620: Flags [P.], seq 30232:30396, ack 1, win 501, length 164
20:19:52.360954 IP comp3134-winter2023.ssh > 198.96.84.224.50620: Flags [P.], seq 30396:30560, ack 1, win 501, length 164
20:19:52.361049 IP comp3134-winter2023.ssh > 198.96.84.224.50620: Flags [P.], seq 30560:30724, ack 1, win 501, length 164
20:19:52.361131 IP comp3134-winter2023.ssh > 198.96.84.224.50620: Flags [P.], seq 30724:30888, ack 1, win 501, length 164
20:19:52.361212 IP comp3134-winter2023.ssh > 198.96.84.224.50620: Flags [P.], seq 30888:31052, ack 1, win 501, length 164
20:19:52.361291 IP comp3134-winter2023.ssh > 198.96.84.224.50620: Flags [P.], seq 31052:31216, ack 1, win 501, length 164
20:19:52.361453 IP comp3134-winter2023.ssh > 198.96.84.224.50620: Flags [P.], seq 31216:31380, ack 1, win 501, length 164
20:19:52.362123 IP 198.96.84.224.50620 > comp3134-winter2023.ssh: Flags [.], ack 26848, win 512, length 0
20:19:52.362123 IP 198.96.84.224.50620 > comp3134-winter2023.ssh: Flags [.], ack 27772, win 509, length 0
20:19:52.362123 IP 198.96.84.224.50620 > comp3134-winter2023.ssh: Flags [.], ack 29248, win 512, length 0
20:19:52.362172 IP comp3134-winter2023.ssh > 198.96.84.224.50620: Flags [P.], seq 31380:31544, ack 1, win 501, length 164
20:19:52.362364 IP comp3134-winter2023.ssh > 198.96.84.224.50620: Flags [P.], seq 31544:32028, ack 1, win 501, length 484
20:19:52.362446 IP comp3134-winter2023.ssh > 198.96.84.224.50620: Flags [P.], seq 32028:32192, ack 1, win 501, length 164
20:19:52.362508 IP comp3134-winter2023.ssh > 198.96.84.224.50620: Flags [P.], seq 32192:32356, ack 1, win 501, length 164
20:19:52.362562 IP comp3134-winter2023.ssh > 198.96.84.224.50620: Flags [P.], seq 32356:32520, ack 1, win 501, length 164
20:19:52.362613 IP comp3134-winter2023.ssh > 198.96.84.224.50620: Flags [P.], seq 32520:32684, ack 1, win 501, length 164
20:19:52.362665 IP comp3134-winter2023.ssh > 198.96.84.224.50620: Flags [P.], seq 32684:32848, ack 1, win 501, length 164
20:19:52.362927 IP comp3134-winter2023.ssh > 198.96.84.224.50620: Flags [P.], seq 32848:33012, ack 1, win 501, length 164
20:19:52.363035 IP comp3134-winter2023.ssh > 198.96.84.224.50620: Flags [P.], seq 33012:33176, ack 1, win 501, length 164
20:19:52.363163 IP comp3134-winter2023.ssh > 198.96.84.224.50620: Flags [P.], seq 33176:33340, ack 1, win 501, length 164
20:19:52.363222 IP comp3134-winter2023.ssh > 198.96.84.224.50620: Flags [P.], seq 33340:33504, ack 1, win 501, length 164
20:19:52.363328 IP comp3134-winter2023.ssh > 198.96.84.224.50620: Flags [P.], seq 33504:33668, ack 1, win 501, length 164
20:19:52.363498 IP comp3134-winter2023.ssh > 198.96.84.224.50620: Flags [P.], seq 33668:33832, ack 1, win 501, length 164
20:19:52.363601 IP comp3134-winter2023.ssh > 198.96.84.224.50620: Flags [P.], seq 33832:33996, ack 1, win 501, length 164
20:19:52.363666 IP comp3134-winter2023.ssh > 198.96.84.224.50620: Flags [P.], seq 33996:34160, ack 1, win 501, length 164
20:19:52.363724 IP comp3134-winter2023.ssh > 198.96.84.224.50620: Flags [P.], seq 34160:34324, ack 1, win 501, length 164
20:19:52.363869 IP comp3134-winter2023.ssh > 198.96.84.224.50620: Flags [P.], seq 34324:34488, ack 1, win 501, length 164
20:19:52.363911 IP 198.96.84.224.50620 > comp3134-winter2023.ssh: Flags [.], ack 30396, win 508, length 0
20:19:52.363911 IP 198.96.84.224.50620 > comp3134-winter2023.ssh: Flags [.], ack 31380, win 512, length 0
20:19:52.364015 IP comp3134-winter2023.ssh > 198.96.84.224.50620: Flags [P.], seq 34488:34860, ack 1, win 501, length 372
20:19:52.364276 IP comp3134-winter2023.ssh > 198.96.84.224.50620: Flags [P.], seq 34860:35024, ack 1, win 501, length 164
20:19:52.364479 IP comp3134-winter2023.ssh > 198.96.84.224.50620: Flags [P.], seq 35024:35188, ack 1, win 501, length 164
20:19:52.364594 IP comp3134-winter2023.ssh > 198.96.84.224.50620: Flags [P.], seq 35188:35352, ack 1, win 501, length 164
20:19:52.364770 IP comp3134-winter2023.ssh > 198.96.84.224.50620: Flags [P.], seq 35352:35516, ack 1, win 501, length 164
20:19:52.364855 IP comp3134-winter2023.ssh > 198.96.84.224.50620: Flags [P.], seq 35516:35680, ack 1, win 501, length 164
20:19:52.364987 IP comp3134-winter2023.ssh > 198.96.84.224.50620: Flags [P.], seq 35680:35844, ack 1, win 501, length 164
20:19:52.365059 IP comp3134-winter2023.ssh > 198.96.84.224.50620: Flags [P.], seq 35844:36008, ack 1, win 501, length 164
20:19:52.365182 IP comp3134-winter2023.ssh > 198.96.84.224.50620: Flags [P.], seq 36008:36172, ack 1, win 501, length 164
20:19:52.365249 IP comp3134-winter2023.ssh > 198.96.84.224.50620: Flags [P.], seq 36172:36336, ack 1, win 501, length 164
20:19:52.365355 IP comp3134-winter2023.ssh > 198.96.84.224.50620: Flags [P.], seq 36336:36500, ack 1, win 501, length 164
20:19:52.365485 IP 198.96.84.224.50620 > comp3134-winter2023.ssh: Flags [.], ack 31544, win 512, length 0
20:19:52.365485 IP 198.96.84.224.50620 > comp3134-winter2023.ssh: Flags [.], ack 32848, win 512, length 0
20:19:52.365607 IP comp3134-winter2023.ssh > 198.96.84.224.50620: Flags [P.], seq 36500:36872, ack 1, win 501, length 372
20:19:52.365755 IP 198.96.84.224.50620 > comp3134-winter2023.ssh: Flags [.], ack 34324, win 512, length 0
20:19:52.365874 IP comp3134-winter2023.ssh > 198.96.84.224.50620: Flags [P.], seq 36872:37140, ack 1, win 501, length 268
20:19:52.365941 IP comp3134-winter2023.ssh > 198.96.84.224.50620: Flags [P.], seq 37140:37304, ack 1, win 501, length 164
20:19:52.365998 IP comp3134-winter2023.ssh > 198.96.84.224.50620: Flags [P.], seq 37304:37468, ack 1, win 501, length 164
20:19:52.366338 IP comp3134-winter2023.ssh > 198.96.84.224.50620: Flags [P.], seq 37468:37632, ack 1, win 501, length 164
20:19:52.366417 IP comp3134-winter2023.ssh > 198.96.84.224.50620: Flags [P.], seq 37632:37796, ack 1, win 501, length 164
20:19:52.367332 IP 198.96.84.224.50620 > comp3134-winter2023.ssh: Flags [.], ack 34860, win 510, length 0
20:19:52.367366 IP comp3134-winter2023.ssh > 198.96.84.224.50620: Flags [P.], seq 37796:37960, ack 1, win 501, length 164
20:19:52.367408 IP 198.96.84.224.50620 > comp3134-winter2023.ssh: Flags [.], ack 36336, win 512, length 0
20:19:52.367520 IP comp3134-winter2023.ssh > 198.96.84.224.50620: Flags [P.], seq 37960:38332, ack 1, win 501, length 372
20:19:52.367657 IP comp3134-winter2023.ssh > 198.96.84.224.50620: Flags [P.], seq 38332:38496, ack 1, win 501, length 164
20:19:52.367772 IP comp3134-winter2023.ssh > 198.96.84.224.50620: Flags [P.], seq 38496:38660, ack 1, win 501, length 164
20:19:52.367942 IP comp3134-winter2023.ssh > 198.96.84.224.50620: Flags [P.], seq 38660:38824, ack 1, win 501, length 164
20:19:52.368008 IP comp3134-winter2023.ssh > 198.96.84.224.50620: Flags [P.], seq 38824:38988, ack 1, win 501, length 164
20:19:52.368135 IP comp3134-winter2023.ssh > 198.96.84.224.50620: Flags [P.], seq 38988:39152, ack 1, win 501, length 164
20:19:52.368209 IP comp3134-winter2023.ssh > 198.96.84.224.50620: Flags [P.], seq 39152:39316, ack 1, win 501, length 164
20:19:52.368264 IP comp3134-winter2023.ssh > 198.96.84.224.50620: Flags [P.], seq 39316:39480, ack 1, win 501, length 164
20:19:52.368316 IP comp3134-winter2023.ssh > 198.96.84.224.50620: Flags [P.], seq 39480:39644, ack 1, win 501, length 164
20:19:52.368372 IP comp3134-winter2023.ssh > 198.96.84.224.50620: Flags [P.], seq 39644:39808, ack 1, win 501, length 164
20:19:52.368425 IP comp3134-winter2023.ssh > 198.96.84.224.50620: Flags [P.], seq 39808:39972, ack 1, win 501, length 164
20:19:52.368480 IP comp3134-winter2023.ssh > 198.96.84.224.50620: Flags [P.], seq 39972:40136, ack 1, win 501, length 164
20:19:52.368533 IP comp3134-winter2023.ssh > 198.96.84.224.50620: Flags [P.], seq 40136:40300, ack 1, win 501, length 164
20:19:52.368584 IP comp3134-winter2023.ssh > 198.96.84.224.50620: Flags [P.], seq 40300:40464, ack 1, win 501, length 164
20:19:52.368701 IP comp3134-winter2023.ssh > 198.96.84.224.50620: Flags [P.], seq 40464:40628, ack 1, win 501, length 164
20:19:52.368759 IP comp3134-winter2023.ssh > 198.96.84.224.50620: Flags [P.], seq 40628:40792, ack 1, win 501, length 164
20:19:52.368934 IP comp3134-winter2023.ssh > 198.96.84.224.50620: Flags [P.], seq 40792:40956, ack 1, win 501, length 164
20:19:52.369044 IP comp3134-winter2023.ssh > 198.96.84.224.50620: Flags [P.], seq 40956:41120, ack 1, win 501, length 164
20:19:52.369123 IP comp3134-winter2023.ssh > 198.96.84.224.50620: Flags [P.], seq 41120:41284, ack 1, win 501, length 164
20:19:52.369186 IP comp3134-winter2023.ssh > 198.96.84.224.50620: Flags [P.], seq 41284:41448, ack 1, win 501, length 164
20:19:52.369300 IP comp3134-winter2023.ssh > 198.96.84.224.50620: Flags [P.], seq 41448:41612, ack 1, win 501, length 164
20:19:52.369360 IP comp3134-winter2023.ssh > 198.96.84.224.50620: Flags [P.], seq 41612:41776, ack 1, win 501, length 164
20:19:52.369419 IP comp3134-winter2023.ssh > 198.96.84.224.50620: Flags [P.], seq 41776:41940, ack 1, win 501, length 164
20:19:52.369479 IP comp3134-winter2023.ssh > 198.96.84.224.50620: Flags [P.], seq 41940:42104, ack 1, win 501, length 164
20:19:52.369594 IP comp3134-winter2023.ssh > 198.96.84.224.50620: Flags [P.], seq 42104:42268, ack 1, win 501, length 164
20:19:52.386499 IP 198.96.84.224.50620 > comp3134-winter2023.ssh: Flags [.], ack 37304, win 509, length 0
20:19:52.386499 IP 198.96.84.224.50620 > comp3134-winter2023.ssh: Flags [.], ack 37632, win 507, length 0
20:19:52.386500 IP 198.96.84.224.50620 > comp3134-winter2023.ssh: Flags [.], ack 38496, win 512, length 0
20:19:52.386500 IP 198.96.84.224.50620 > comp3134-winter2023.ssh: Flags [.], ack 38988, win 510, length 0
20:19:52.386500 IP 198.96.84.224.50620 > comp3134-winter2023.ssh: Flags [.], ack 41120, win 512, length 0
20:19:52.386500 IP 198.96.84.224.50620 > comp3134-winter2023.ssh: Flags [.], ack 42268, win 508, length 0
20:19:52.386575 IP comp3134-winter2023.ssh > 198.96.84.224.50620: Flags [P.], seq 42268:42432, ack 1, win 501, length 164
20:19:52.387017 IP comp3134-winter2023.ssh > 198.96.84.224.50620: Flags [P.], seq 42432:43236, ack 1, win 501, length 804
20:19:52.387157 IP comp3134-winter2023.ssh > 198.96.84.224.50620: Flags [P.], seq 43236:43400, ack 1, win 501, length 164
20:19:52.387251 IP comp3134-winter2023.ssh > 198.96.84.224.50620: Flags [P.], seq 43400:43564, ack 1, win 501, length 164
20:19:52.387341 IP comp3134-winter2023.ssh > 198.96.84.224.50620: Flags [P.], seq 43564:43728, ack 1, win 501, length 164
20:19:52.387439 IP comp3134-winter2023.ssh > 198.96.84.224.50620: Flags [P.], seq 43728:43892, ack 1, win 501, length 164
20:19:52.387515 IP comp3134-winter2023.ssh > 198.96.84.224.50620: Flags [P.], seq 43892:44056, ack 1, win 501, length 164
20:19:52.387575 IP comp3134-winter2023.ssh > 198.96.84.224.50620: Flags [P.], seq 44056:44220, ack 1, win 501, length 164
20:19:52.387628 IP comp3134-winter2023.ssh > 198.96.84.224.50620: Flags [P.], seq 44220:44384, ack 1, win 501, length 164
20:19:52.388460 IP comp3134-winter2023.ssh > 198.96.84.224.50620: Flags [P.], seq 44384:44548, ack 1, win 501, length 164
20:19:52.388597 IP comp3134-winter2023.ssh > 198.96.84.224.50620: Flags [P.], seq 44548:44712, ack 1, win 501, length 164
20:19:52.388656 IP comp3134-winter2023.ssh > 198.96.84.224.50620: Flags [P.], seq 44712:44876, ack 1, win 501, length 164
20:19:52.388711 IP comp3134-winter2023.ssh > 198.96.84.224.50620: Flags [P.], seq 44876:45040, ack 1, win 501, length 164
20:19:52.388761 IP comp3134-winter2023.ssh > 198.96.84.224.50620: Flags [P.], seq 45040:45204, ack 1, win 501, length 164
20:19:52.388813 IP comp3134-winter2023.ssh > 198.96.84.224.50620: Flags [P.], seq 45204:45368, ack 1, win 501, length 164
20:19:52.388863 IP comp3134-winter2023.ssh > 198.96.84.224.50620: Flags [P.], seq 45368:45532, ack 1, win 501, length 164
20:19:52.388916 IP comp3134-winter2023.ssh > 198.96.84.224.50620: Flags [P.], seq 45532:45696, ack 1, win 501, length 164
20:19:52.388970 IP comp3134-winter2023.ssh > 198.96.84.224.50620: Flags [P.], seq 45696:45860, ack 1, win 501, length 164
20:19:52.389073 IP comp3134-winter2023.ssh > 198.96.84.224.50620: Flags [P.], seq 45860:46024, ack 1, win 501, length 164
20:19:52.389162 IP comp3134-winter2023.ssh > 198.96.84.224.50620: Flags [P.], seq 46024:46188, ack 1, win 501, length 164
20:19:52.389227 IP comp3134-winter2023.ssh > 198.96.84.224.50620: Flags [P.], seq 46188:46352, ack 1, win 501, length 164
20:19:52.389281 IP comp3134-winter2023.ssh > 198.96.84.224.50620: Flags [P.], seq 46352:46516, ack 1, win 501, length 164
20:19:52.389331 IP comp3134-winter2023.ssh > 198.96.84.224.50620: Flags [P.], seq 46516:46680, ack 1, win 501, length 164
20:19:52.389384 IP comp3134-winter2023.ssh > 198.96.84.224.50620: Flags [P.], seq 46680:46844, ack 1, win 501, length 164
20:19:52.389433 IP comp3134-winter2023.ssh > 198.96.84.224.50620: Flags [P.], seq 46844:47008, ack 1, win 501, length 164
20:19:52.389483 IP comp3134-winter2023.ssh > 198.96.84.224.50620: Flags [P.], seq 47008:47172, ack 1, win 501, length 164
20:19:52.389533 IP comp3134-winter2023.ssh > 198.96.84.224.50620: Flags [P.], seq 47172:47336, ack 1, win 501, length 164
20:19:52.389581 IP comp3134-winter2023.ssh > 198.96.84.224.50620: Flags [P.], seq 47336:47500, ack 1, win 501, length 164
20:19:52.389628 IP comp3134-winter2023.ssh > 198.96.84.224.50620: Flags [P.], seq 47500:47664, ack 1, win 501, length 164
20:19:52.389676 IP comp3134-winter2023.ssh > 198.96.84.224.50620: Flags [P.], seq 47664:47828, ack 1, win 501, length 164
20:19:52.389739 IP comp3134-winter2023.ssh > 198.96.84.224.50620: Flags [P.], seq 47828:47992, ack 1, win 501, length 164
20:19:52.389791 IP comp3134-winter2023.ssh > 198.96.84.224.50620: Flags [P.], seq 47992:48156, ack 1, win 501, length 164
20:19:52.393523 IP 198.96.84.224.50620 > comp3134-winter2023.ssh: Flags [.], ack 44220, win 512, length 0
20:19:52.393524 IP 198.96.84.224.50620 > comp3134-winter2023.ssh: Flags [.], ack 44876, win 510, length 0
20:19:52.393524 IP 198.96.84.224.50620 > comp3134-winter2023.ssh: Flags [.], ack 46352, win 512, length 0
20:19:52.393524 IP 198.96.84.224.50620 > comp3134-winter2023.ssh: Flags [.], ack 47992, win 512, length 0
20:19:52.393594 IP comp3134-winter2023.ssh > 198.96.84.224.50620: Flags [P.], seq 48156:48320, ack 1, win 501, length 164
20:19:52.393855 IP comp3134-winter2023.ssh > 198.96.84.224.50620: Flags [P.], seq 48320:48908, ack 1, win 501, length 588
20:19:52.393926 IP comp3134-winter2023.ssh > 198.96.84.224.50620: Flags [P.], seq 48908:49072, ack 1, win 501, length 164
20:19:52.393984 IP comp3134-winter2023.ssh > 198.96.84.224.50620: Flags [P.], seq 49072:49236, ack 1, win 501, length 164
20:19:52.394038 IP comp3134-winter2023.ssh > 198.96.84.224.50620: Flags [P.], seq 49236:49400, ack 1, win 501, length 164
20:19:52.394147 IP comp3134-winter2023.ssh > 198.96.84.224.50620: Flags [P.], seq 49400:49564, ack 1, win 501, length 164
20:19:52.394242 IP comp3134-winter2023.ssh > 198.96.84.224.50620: Flags [P.], seq 49564:49728, ack 1, win 501, length 164
20:19:52.394330 IP comp3134-winter2023.ssh > 198.96.84.224.50620: Flags [P.], seq 49728:49892, ack 1, win 501, length 164
20:19:52.394418 IP comp3134-winter2023.ssh > 198.96.84.224.50620: Flags [P.], seq 49892:50056, ack 1, win 501, length 164
20:19:52.394503 IP comp3134-winter2023.ssh > 198.96.84.224.50620: Flags [P.], seq 50056:50220, ack 1, win 501, length 164
20:19:52.394588 IP comp3134-winter2023.ssh > 198.96.84.224.50620: Flags [P.], seq 50220:50384, ack 1, win 501, length 164
20:19:52.394675 IP comp3134-winter2023.ssh > 198.96.84.224.50620: Flags [P.], seq 50384:50548, ack 1, win 501, length 164
20:19:52.394931 IP comp3134-winter2023.ssh > 198.96.84.224.50620: Flags [P.], seq 50548:50712, ack 1, win 501, length 164
20:19:52.395070 IP comp3134-winter2023.ssh > 198.96.84.224.50620: Flags [P.], seq 50712:50876, ack 1, win 501, length 164
20:19:52.395160 IP comp3134-winter2023.ssh > 198.96.84.224.50620: Flags [P.], seq 50876:51040, ack 1, win 501, length 164
